<?xml version="1.0" encoding="UTF-8"?>
<!DOCTYPE albaran SYSTEM "albaranes.dtd">
<albaran>
    <numero>8</numero>
    <fecha>2011-10-03</fecha>
    <cliente id="1">
        <nombre>Francisco García</nombre>
        <poblacion>Orihuela</poblacion>        
    </cliente>
    <articulos>
        <compra>
            <articulo codigo="9">
                <descripcion>Vino Valdepeñas gran reserva. Viña Albali 75cl</descripcion>
                <botella/>
                <precio>4.98</precio>
            </articulo>
            <cantidad>3</cantidad>
        </compra>                
        <compra>
            <articulo codigo="12">
                <descripcion>Vino tinto Rioja reserva. Marques de Riscal 75 cl</descripcion>
                <botella/>
                <precio>12.85</precio>
            </articulo>
            <cantidad>1</cantidad>
        </compra>
        <compra>
            <articulo codigo="58">
                <descripcion>Vino Ribera de Duero crianza. Valpicia 75 cl</descripcion>
                <botella/>
                <precio>5,49</precio>
            </articulo>
            <cantidad>1</cantidad>
        </compra>                        
    </articulos>    
</albaran>

